<?xml version="1.0" encoding="UTF-8"?>

<!--
    Document   : calendar.xml
    Created on : 27. duben 2011, 16:13
    Author     : AdiC
    Description:
        Purpose of the document follows.
-->

<xs:calendar  xmlns:xsi='http://www.w3.org/2001/XMLSchema-instance'
   xmlns:xs='http://xml.netbeans.org/schema/calendar-schema'
   xsi:schemaLocation='http://xml.netbeans.org/schema/calendar-schema calendar-schema.xsd'>
    <xs:event id="">
        <xs:since></xs:since>
        <xs:to></xs:to>
        <xs:date></xs:date>
        <xs:title></xs:title>
        <xs:place></xs:place>
        <xs:note></xs:note>
    </xs:event>

</xs:calendar>
