<?xml version="1.0" encoding="UTF-8"?>

<!--
    Document   : calendar.xml
    Created on : 27. duben 2011, 16:13
    Author     : AdiC
    Description:
        Purpose of the document follows.
-->

<xs:calendar  xmlns:xsi='http://www.w3.org/2001/XMLSchema-instance'
   xmlns:xs='http://xml.netbeans.org/schema/calendar-schema'
   xsi:schemaLocation='http://xml.netbeans.org/schema/calendar-schema calendar-schema.xsd'>
    <xs:event id="1">
        <xs:since>12:00:00</xs:since>
        <xs:duration>PT1H</xs:duration>
        <xs:date>2011-04-30</xs:date>
        <xs:title>Title1 - noPlace noNote noLabels</xs:title>
    </xs:event>
    <xs:event id="2">
        <xs:since>13:00:00</xs:since>
        <xs:duration>PT1H</xs:duration>
        <xs:date>2011-05-31</xs:date>
        <xs:title>Title2 - noNote noLabels</xs:title>
        <xs:place>Brno</xs:place>
    </xs:event>
    <xs:event id="3">
        <xs:since>12:00:00</xs:since>
        <xs:duration>PT1H</xs:duration>
        <xs:date>2011-04-30</xs:date>
        <xs:title>Title13 - noPlace noNote</xs:title>
        <xs:labels>
            <xs:tag>work</xs:tag>
        </xs:labels>
    </xs:event>
    <xs:event id="4">
        <xs:since>12:00:00</xs:since>
        <xs:duration>PT1H</xs:duration>
        <xs:date>2011-04-30</xs:date>
        <xs:title>Title4</xs:title>
        <xs:place>Prague</xs:place>
        <xs:note>new note</xs:note>     
        <xs:labels>
            <xs:tag>Work</xs:tag>
            <xs:tag>Important</xs:tag>
        </xs:labels>
    </xs:event>
 
</xs:calendar>
